{
  "spec_version": "agenomic.rmp.enrichment/v0.1",
  "proposal_id": "sep_01JZWXA1B2",
  "source_finding_id": "fnd_loop_1",
  "source_event_ids": ["evt_01JZWX5D"],
  "proposed_scenario": {
    "spec_version": "agenomic.rmp.scenario/v0.1",
    "scenario_id": "sc_01JZWXA1C3",
    "title": "Loop regression: Repeated tool call: compensation_lookup ×14",
    "description": "Replay the event sequence that produced the loop and assert the loop bound is respected. Source: Repeated tool call: compensation_lookup ×14",
    "source": "monitor_derived",
    "agent_id": "agent://treans/claims-agent",
    "risk_ids": ["risk_wrong_payout"],
    "inputs": [],
    "expected_outputs": [],
    "expected_tool_calls": [],
    "forbidden_behaviors": ["unbounded_repeated_tool_calls"],
    "policy_expectations": [],
    "metrics_to_compute": ["regression_recurrence_rate"],
    "severity": "high",
    "tags": ["enrichment", "loop"],
    "created_at": "2026-07-11T09:22:00Z",
    "created_by": "rmp:monitor",
    "evidence_source_refs": ["evt_01JZWX5D"],
    "dataset_refs": []
  },
  "risk_ids": ["risk_wrong_payout"],
  "reason": "a loop detected in production becomes a loop regression scenario",
  "expected_coverage_improvement": 0.3,
  "severity": "high",
  "human_approval_required": true,
  "status": "pending_review",
  "created_at": "2026-07-11T09:22:00Z"
}
